{
  "kind": "relay.assignment",
  "schemaVersion": "1.0",
  "assignment": {
    "id": "assignment-1785734898916",
    "title": "UI quality loop",
    "task": "Complete the supplied task by executing the workflow graph and preserving its decision history.",
    "createdAt": "2026-08-03T05:28:18.916Z"
  },
  "workflow": {
    "schemaVersion": "1.0",
    "id": "ui-quality-loop",
    "name": "UI quality loop",
    "description": "Implement, review in parallel, loop on quality failures, and prepare a handoff.",
    "project": {
      "name": "No project selected",
      "root": "",
      "branch": "",
      "variables": {
        "project.instructions": "AGENTS.md",
        "commands.check": "",
        "commands.test": "",
        "preview.url": "",
        "visual.tolerance": ""
      }
    },
    "nodes": [
      {
        "id": "implement",
        "type": "workflow",
        "position": {
          "x": 40,
          "y": 245
        },
        "data": {
          "label": "Implement UI",
          "description": "Implement the run objective using the connected project instructions.",
          "templateId": "implement-ui",
          "kind": "agent",
          "icon": "wand",
          "color": "mint",
          "status": "idle",
          "instruction": "You are the implementation agent for **{{project.name}}**.\n\nRead `{{project.instructions}}` and the supplied brief before changing code. Implement the smallest complete solution that matches the existing architecture and design language.\n\n## Guardrails\n\n- Preserve unrelated changes.\n- Prefer existing primitives and tokens.\n- Run `{{commands.check}}` before returning.\n- Return changed files, decisions, and known limitations.\n\n## Task\n\n{{task}}",
          "overrides": {}
        },
        "measured": {
          "width": 286,
          "height": 148
        }
      },
      {
        "id": "review",
        "type": "workflow",
        "position": {
          "x": 445,
          "y": 72
        },
        "data": {
          "label": "Code review",
          "description": "Check correctness, maintainability, and project conventions.",
          "templateId": "code-review",
          "kind": "judge",
          "icon": "scan",
          "color": "blue",
          "status": "idle",
          "instruction": "Review the current patch against the task and the conventions in `{{project.instructions}}`.\n\nPrioritize findings that can cause incorrect behavior, regressions, security issues, data loss, or broken tests. Include file and line references. Do not block on style preferences already enforced by tooling.\n\nReturn:\n\n1. `verdict`: `pass` or `revise`\n2. `findings`: ordered by severity\n3. `summary`: one concise paragraph",
          "overrides": {}
        },
        "measured": {
          "width": 286,
          "height": 148
        }
      },
      {
        "id": "visual",
        "type": "workflow",
        "position": {
          "x": 445,
          "y": 395
        },
        "data": {
          "label": "Visual judge",
          "description": "Compare desktop and mobile renders to the reference.",
          "templateId": "visual-judge",
          "kind": "judge",
          "icon": "eye",
          "color": "violet",
          "status": "idle",
          "instruction": "Inspect the rendered result at `{{preview.url}}` in the configured viewports.\n\nEvaluate hierarchy, spacing, typography, alignment, contrast, responsive behavior, and fidelity to the reference. Separate objective mismatches from aesthetic suggestions.\n\nPass when there are no blocking mismatches. Otherwise return `revise` with measurable corrections and attach an annotated screenshot when possible.\n\nTolerance: `{{visual.tolerance}}`",
          "overrides": {}
        },
        "measured": {
          "width": 286,
          "height": 148
        }
      },
      {
        "id": "gate",
        "type": "workflow",
        "position": {
          "x": 840,
          "y": 235
        },
        "data": {
          "label": "Quality gate",
          "description": "Merge reviewer verdicts and choose the next route.",
          "templateId": "decision-gate",
          "kind": "router",
          "icon": "split",
          "color": "coral",
          "status": "idle",
          "instruction": "Read every upstream verdict.\n\n- Route to `ship` only when all required verdicts are `pass`.\n- Route to `revise` when any required verdict is `revise`.\n- Route to `blocked` when a required verdict is missing or malformed.\n\nReturn only the selected route and a one-sentence reason.",
          "overrides": {}
        },
        "measured": {
          "width": 286,
          "height": 148
        }
      },
      {
        "id": "ship",
        "type": "workflow",
        "position": {
          "x": 1225,
          "y": 235
        },
        "data": {
          "label": "Ship summary",
          "description": "Prepare a pull request-ready handoff.",
          "templateId": "summarize",
          "kind": "agent",
          "icon": "file-check",
          "color": "cyan",
          "status": "idle",
          "instruction": "Create a concise final handoff for **{{project.name}}**.\n\nInclude what changed, why, verification performed, and any remaining risks. Prefer concrete evidence over process narration. Format the result so it can be pasted into a pull request description.",
          "overrides": {}
        },
        "measured": {
          "width": 286,
          "height": 148
        }
      }
    ],
    "edges": [
      {
        "id": "implement-review",
        "source": "implement",
        "target": "review",
        "type": "workflow",
        "markerEnd": {
          "type": "arrowclosed",
          "width": 16,
          "height": 16
        },
        "data": {
          "tone": "success",
          "trigger": "always",
          "payload": { "mode": "all" },
          "onBlocked": "wait"
        }
      },
      {
        "id": "implement-visual",
        "source": "implement",
        "target": "visual",
        "type": "workflow",
        "markerEnd": {
          "type": "arrowclosed",
          "width": 16,
          "height": 16
        },
        "data": {
          "tone": "default",
          "trigger": "always",
          "payload": { "mode": "all" },
          "onBlocked": "wait"
        }
      },
      {
        "id": "review-gate",
        "source": "review",
        "target": "gate",
        "type": "workflow",
        "markerEnd": {
          "type": "arrowclosed",
          "width": 16,
          "height": 16
        },
        "data": {
          "tone": "success",
          "trigger": "always",
          "payload": { "mode": "all" },
          "onBlocked": "wait"
        }
      },
      {
        "id": "visual-gate",
        "source": "visual",
        "target": "gate",
        "type": "workflow",
        "markerEnd": {
          "type": "arrowclosed",
          "width": 16,
          "height": 16
        },
        "data": {
          "tone": "default",
          "trigger": "always",
          "payload": { "mode": "all" },
          "onBlocked": "wait"
        }
      },
      {
        "id": "gate-ship",
        "source": "gate",
        "target": "ship",
        "type": "workflow",
        "markerEnd": {
          "type": "arrowclosed",
          "width": 16,
          "height": 16
        },
        "data": {
          "label": "pass",
          "tone": "success",
          "trigger": "condition",
          "condition": "route == ship",
          "payload": { "mode": "summary" },
          "onBlocked": "wait"
        }
      },
      {
        "id": "gate-loop",
        "source": "gate",
        "target": "implement",
        "type": "workflow",
        "markerEnd": {
          "type": "arrowclosed",
          "width": 16,
          "height": 16
        },
        "sourceHandle": "source-bottom",
        "targetHandle": "target-bottom",
        "data": {
          "label": "revise",
          "tone": "danger",
          "trigger": "condition",
          "condition": "route == revise",
          "payload": { "mode": "all" },
          "onBlocked": "wait",
          "loop": {
            "mode": "bounded",
            "maxIterations": 3,
            "maxDurationMinutes": 30,
            "stopOnNoProgress": 2,
            "onExhausted": "human"
          }
        }
      }
    ],
    "updatedAt": "2026-08-03T05:28:18.916Z"
  },
  "components": [
    {
      "id": "code-review",
      "name": "Code review",
      "description": "Review the implementation for correctness, safety, and maintainability.",
      "kind": "judge",
      "icon": "scan",
      "color": "blue",
      "version": "1.0.0",
      "tags": [
        "review",
        "quality"
      ],
      "inputs": [
        "patch",
        "project_context"
      ],
      "outputs": [
        "verdict",
        "findings"
      ],
      "instruction": "Review the current patch against the task and the conventions in `{{project.instructions}}`.\n\nPrioritize findings that can cause incorrect behavior, regressions, security issues, data loss, or broken tests. Include file and line references. Do not block on style preferences already enforced by tooling.\n\nReturn:\n\n1. `verdict`: `pass` or `revise`\n2. `findings`: ordered by severity\n3. `summary`: one concise paragraph"
    },
    {
      "id": "implement-ui",
      "name": "Implement UI",
      "description": "Build the requested interface from the brief and project conventions.",
      "kind": "agent",
      "icon": "wand",
      "color": "mint",
      "version": "1.0.0",
      "tags": [
        "build",
        "frontend"
      ],
      "inputs": [
        "brief",
        "project_context"
      ],
      "outputs": [
        "patch",
        "implementation_notes"
      ],